Difficulty,Title,Frequency,Acceptance Rate,Link,Topics,count
EASY,Valid Parentheses,77.1,0.4232281667216221,https://leetcode.com/problems/valid-parentheses,"String, Stack",11
EASY,Two Sum,88.0,0.5577702651795842,https://leetcode.com/problems/two-sum,"Array, Hash Table",10
MEDIUM,3Sum,88.0,0.3707108091763312,https://leetcode.com/problems/3sum,"Array, Two Pointers, Sorting",10
MEDIUM,Longest Substring Without Repeating Characters,88.0,0.3693614497740018,https://leetcode.com/problems/longest-substring-without-repeating-characters,"Hash Table, String, Sliding Window",10
MEDIUM,Merge Intervals,73.2,0.4939526774846352,https://leetcode.com/problems/merge-intervals,"Array, Sorting",9
EASY,Climbing Stairs,88.0,0.535407976724555,https://leetcode.com/problems/climbing-stairs,"Math, Dynamic Programming, Memoization",9
EASY,Best Time to Buy and Sell Stock,100.0,0.5526330377484631,https://leetcode.com/problems/best-time-to-buy-and-sell-stock,"Array, Dynamic Programming",8
HARD,Trapping Rain Water,84.5,0.6510192881379091,https://leetcode.com/problems/trapping-rain-water,"Array, Two Pointers, Dynamic Programming, Stack, Monotonic Stack",8
EASY,Merge Sorted Array,82.8,0.5291952052651709,https://leetcode.com/problems/merge-sorted-array,"Array, Two Pointers, Sorting",8
MEDIUM,Rotate Image,100.0,0.7790173789665304,https://leetcode.com/problems/rotate-image,"Array, Math, Matrix",8
MEDIUM,Group Anagrams,76.9,0.7092880631912374,https://leetcode.com/problems/group-anagrams,"Array, Hash Table, String, Sorting",8
MEDIUM,Add Two Numbers,76.3,0.4622507658063209,https://leetcode.com/problems/add-two-numbers,"Linked List, Math, Recursion",8
MEDIUM,Maximum Subarray,69.1,0.5209977771112393,https://leetcode.com/problems/maximum-subarray,"Array, Divide and Conquer, Dynamic Programming",8
EASY,Remove Duplicates from Sorted Array,61.5,0.6035551112882038,https://leetcode.com/problems/remove-duplicates-from-sorted-array,"Array, Two Pointers",7
MEDIUM,Number of Islands,47.6,0.6231996817686392,https://leetcode.com/problems/number-of-islands,"Array, Depth-First Search, Breadth-First Search, Union Find, Matrix",7
MEDIUM,LRU Cache,63.3,0.4521462265150519,https://leetcode.com/problems/lru-cache,"Hash Table, Linked List, Design, Doubly-Linked List",7
MEDIUM,Reverse Integer,65.3,0.3030891688448359,https://leetcode.com/problems/reverse-integer,Math,7
EASY,Palindrome Number,67.4,0.5922455404045137,https://leetcode.com/problems/palindrome-number,Math,7
EASY,Merge Two Sorted Lists,64.3,0.6684091757223755,https://leetcode.com/problems/merge-two-sorted-lists,"Linked List, Recursion",6
EASY,Reverse Linked List,47.6,0.7920656598058967,https://leetcode.com/problems/reverse-linked-list,"Linked List, Recursion",6
MEDIUM,Spiral Matrix,100.0,0.539398836789508,https://leetcode.com/problems/spiral-matrix,"Array, Matrix, Simulation",6
MEDIUM,Letter Combinations of a Phone Number,68.3,0.6385756647080152,https://leetcode.com/problems/letter-combinations-of-a-phone-number,"Hash Table, String, Backtracking",6
HARD,Reverse Nodes in k-Group,57.1,0.6304374335039493,https://leetcode.com/problems/reverse-nodes-in-k-group,"Linked List, Recursion",6
EASY,Sqrt(x),51.1,0.4037179972261584,https://leetcode.com/problems/sqrtx,"Math, Binary Search",5
MEDIUM,Reverse Linked List II,46.3,0.4959171394576541,https://leetcode.com/problems/reverse-linked-list-ii,Linked List,5
HARD,N-Queens,52.7,0.7281704967757537,https://leetcode.com/problems/n-queens,"Array, Backtracking",5
HARD,First Missing Positive,57.4,0.4108465766394882,https://leetcode.com/problems/first-missing-positive,"Array, Hash Table",5
MEDIUM,Swap Nodes in Pairs,46.3,0.6720136828647639,https://leetcode.com/problems/swap-nodes-in-pairs,"Linked List, Recursion",5
MEDIUM,Sort Colors,54.5,0.6758312948649591,https://leetcode.com/problems/sort-colors,"Array, Two Pointers, Sorting",5
MEDIUM,Remove Nth Node From End of List,55.6,0.4896103052563428,https://leetcode.com/problems/remove-nth-node-from-end-of-list,"Linked List, Two Pointers",5
MEDIUM,Set Matrix Zeroes,56.5,0.60708786580102,https://leetcode.com/problems/set-matrix-zeroes,"Array, Hash Table, Matrix",5
MEDIUM,Rotate List,42.6,0.3994477271612808,https://leetcode.com/problems/rotate-list,"Linked List, Two Pointers",5
MEDIUM,4Sum,56.8,0.3821902011379304,https://leetcode.com/problems/4sum,"Array, Two Pointers, Sorting",5
MEDIUM,Restore IP Addresses,25.4,0.531583393083398,https://leetcode.com/problems/restore-ip-addresses,"String, Backtracking",5
MEDIUM,Word Search,59.1,0.4526691452685235,https://leetcode.com/problems/word-search,"Array, String, Backtracking, Depth-First Search, Matrix",5
MEDIUM,Generate Parentheses,67.2,0.7713286717803378,https://leetcode.com/problems/generate-parentheses,"String, Dynamic Programming, Backtracking",5
EASY,Longest Common Prefix,70.9,0.4548305505260665,https://leetcode.com/problems/longest-common-prefix,"String, Trie",5
MEDIUM,Longest Palindromic Substring,76.9,0.3584611475412551,https://leetcode.com/problems/longest-palindromic-substring,"Two Pointers, String, Dynamic Programming",5
MEDIUM,Jump Game,68.5,0.3947920375919359,https://leetcode.com/problems/jump-game,"Array, Dynamic Programming, Greedy",5
HARD,Merge k Sorted Lists,66.5,0.567741907864408,https://leetcode.com/problems/merge-k-sorted-lists,"Linked List, Divide and Conquer, Heap (Priority Queue), Merge Sort",5
HARD,Median of Two Sorted Arrays,74.8,0.4381459000864632,https://leetcode.com/problems/median-of-two-sorted-arrays,"Array, Binary Search, Divide and Conquer",5
MEDIUM,Valid Sudoku,60.1,0.6227677721538815,https://leetcode.com/problems/valid-sudoku,"Array, Hash Table, Matrix",5
MEDIUM,Interleaving String,23.5,0.4217918033968859,https://leetcode.com/problems/interleaving-string,"String, Dynamic Programming",4
HARD,Maximal Rectangle,31.5,0.5370845822665518,https://leetcode.com/problems/maximal-rectangle,"Array, Dynamic Programming, Stack, Matrix, Monotonic Stack",4
MEDIUM,Find First and Last Position of Element in Sorted Array,59.3,0.4682873183580639,https://leetcode.com/problems/find-first-and-last-position-of-element-in-sorted-array,"Array, Binary Search",4
EASY,Add Binary,45.8,0.556770003334334,https://leetcode.com/problems/add-binary,"Math, String, Bit Manipulation, Simulation",4
MEDIUM,Kth Largest Element in an Array,88.0,0.6797703802112421,https://leetcode.com/problems/kth-largest-element-in-an-array,"Array, Divide and Conquer, Sorting, Heap (Priority Queue), Quickselect",4
MEDIUM,Insert Interval,42.6,0.4347361196230839,https://leetcode.com/problems/insert-interval,Array,4
MEDIUM,Partition List,32.7,0.5898677373641946,https://leetcode.com/problems/partition-list,"Linked List, Two Pointers",4
EASY,Number of 1 Bits,88.0,0.7450480575885099,https://leetcode.com/problems/number-of-1-bits,"Divide and Conquer, Bit Manipulation",4
HARD,Text Justification,35.0,0.4814988999917213,https://leetcode.com/problems/text-justification,"Array, String, Simulation",4
MEDIUM,Combinations,32.7,0.7289646493270955,https://leetcode.com/problems/combinations,Backtracking,4
EASY,Length of Last Word,42.6,0.5631926112536397,https://leetcode.com/problems/length-of-last-word,String,4
MEDIUM,Container With Most Water,76.4,0.5778282574410597,https://leetcode.com/problems/container-with-most-water,"Array, Two Pointers, Greedy",4
MEDIUM,Minimum Path Sum,41.9,0.664814934885504,https://leetcode.com/problems/minimum-path-sum,"Array, Dynamic Programming, Matrix",4
EASY,Remove Duplicates from Sorted List,41.2,0.5487080353115535,https://leetcode.com/problems/remove-duplicates-from-sorted-list,Linked List,4
MEDIUM,Simplify Path,40.4,0.4785432317744196,https://leetcode.com/problems/simplify-path,"String, Stack",4
MEDIUM,String to Integer (atoi),38.8,0.1922942349527772,https://leetcode.com/problems/string-to-integer-atoi,String,4
MEDIUM,Multiply Strings,37.9,0.4228941429852704,https://leetcode.com/problems/multiply-strings,"Math, String, Simulation",4
MEDIUM,Construct Binary Tree from Preorder and Inorder Traversal,23.6,0.6683774773521286,https://leetcode.com/problems/construct-binary-tree-from-preorder-and-inorder-traversal,"Array, Hash Table, Divide and Conquer, Tree, Binary Tree",4
MEDIUM,Unique Paths,53.5,0.6577283527258664,https://leetcode.com/problems/unique-paths,"Math, Dynamic Programming, Combinatorics",4
MEDIUM,Recover Binary Search Tree,25.4,0.5632432520920791,https://leetcode.com/problems/recover-binary-search-tree,"Tree, Depth-First Search, Binary Search Tree, Binary Tree",4
EASY,Roman to Integer,67.8,0.6486626948713667,https://leetcode.com/problems/roman-to-integer,"Hash Table, Math, String",4
MEDIUM,Next Permutation,63.1,0.4305773671839413,https://leetcode.com/problems/next-permutation,"Array, Two Pointers",4
MEDIUM,Search in Rotated Sorted Array,63.1,0.4283722138743466,https://leetcode.com/problems/search-in-rotated-sorted-array,"Array, Binary Search",4
EASY,Remove Element,53.1,0.600316358048653,https://leetcode.com/problems/remove-element,"Array, Two Pointers",4
MEDIUM,Jump Game II,56.5,0.4150321496760298,https://leetcode.com/problems/jump-game-ii,"Array, Dynamic Programming, Greedy",4
EASY,Find the Index of the First Occurrence in a String,51.9,0.4497159268881767,https://leetcode.com/problems/find-the-index-of-the-first-occurrence-in-a-string,"Two Pointers, String, String Matching",4
MEDIUM,Subsets,55.2,0.808795565390318,https://leetcode.com/problems/subsets,"Array, Backtracking, Bit Manipulation",4
EASY,Missing Number,34.3,0.7006526780574172,https://leetcode.com/problems/missing-number,"Array, Hash Table, Math, Binary Search, Bit Manipulation, Sorting",4
EASY,Plus One,50.7,0.4754760423278756,https://leetcode.com/problems/plus-one,"Array, Math",4
MEDIUM,Search a 2D Matrix,56.8,0.5228955161093151,https://leetcode.com/problems/search-a-2d-matrix,"Array, Binary Search, Matrix",4
MEDIUM,Validate Binary Search Tree,50.7,0.3438038788666115,https://leetcode.com/problems/validate-binary-search-tree,"Tree, Depth-First Search, Binary Search Tree, Binary Tree",4
MEDIUM,Integer to Roman,49.8,0.6861931275088928,https://leetcode.com/problems/integer-to-roman,"Hash Table, Math, String",4
MEDIUM,Spiral Matrix II,18.9,0.734312719680276,https://leetcode.com/problems/spiral-matrix-ii,"Array, Matrix, Simulation",3
EASY,Linked List Cycle,42.0,0.5257065321652596,https://leetcode.com/problems/linked-list-cycle,"Hash Table, Linked List, Two Pointers",3
MEDIUM,Reverse Words in a String,34.3,0.5191329339866777,https://leetcode.com/problems/reverse-words-in-a-string,"Two Pointers, String",3
MEDIUM,Remove Duplicates from Sorted List II,23.5,0.4989080936318432,https://leetcode.com/problems/remove-duplicates-from-sorted-list-ii,"Linked List, Two Pointers",3
MEDIUM,Unique Binary Search Trees,23.5,0.6244520536210353,https://leetcode.com/problems/unique-binary-search-trees,"Math, Dynamic Programming, Tree, Binary Search Tree, Binary Tree",3
MEDIUM,Rotate Array,50.2,0.4302137279999349,https://leetcode.com/problems/rotate-array,"Array, Math, Two Pointers",3
EASY,Is Subsequence,40.7,0.4838262049972864,https://leetcode.com/problems/is-subsequence,"Two Pointers, String, Dynamic Programming",3
MEDIUM,Coin Change,100.0,0.464957320920135,https://leetcode.com/problems/coin-change,"Array, Dynamic Programming, Breadth-First Search",3
MEDIUM,Insert Delete GetRandom O(1),34.3,0.5499185329837445,https://leetcode.com/problems/insert-delete-getrandom-o1,"Array, Hash Table, Math, Design, Randomized",3
MEDIUM,Binary Tree Level Order Traversal,36.4,0.7059658947038693,https://leetcode.com/problems/binary-tree-level-order-traversal,"Tree, Breadth-First Search, Binary Tree",3
EASY,Convert Sorted Array to Binary Search Tree,32.9,0.7407934506434607,https://leetcode.com/problems/convert-sorted-array-to-binary-search-tree,"Array, Divide and Conquer, Tree, Binary Search Tree, Binary Tree",3
EASY,Move Zeroes,47.6,0.628040301372497,https://leetcode.com/problems/move-zeroes,"Array, Two Pointers",3
HARD,Max Points on a Line,51.9,0.2895514653845652,https://leetcode.com/problems/max-points-on-a-line,"Array, Hash Table, Math, Geometry",3
EASY,Reverse Bits,19.1,0.6320547566319765,https://leetcode.com/problems/reverse-bits,"Divide and Conquer, Bit Manipulation",3
MEDIUM,House Robber,96.0,0.5230498170963667,https://leetcode.com/problems/house-robber,"Array, Dynamic Programming",3
MEDIUM,Best Time to Buy and Sell Stock II,43.8,0.6950023404506479,https://leetcode.com/problems/best-time-to-buy-and-sell-stock-ii,"Array, Dynamic Programming, Greedy",3
MEDIUM,Remove Duplicates from Sorted Array II,41.9,0.6290181029288465,https://leetcode.com/problems/remove-duplicates-from-sorted-array-ii,"Array, Two Pointers",3
HARD,Substring with Concatenation of All Words,28.7,0.3299749970274807,https://leetcode.com/problems/substring-with-concatenation-of-all-words,"Hash Table, String, Sliding Window",3
MEDIUM,Permutations,47.9,0.8066011364163758,https://leetcode.com/problems/permutations,"Array, Backtracking",3
MEDIUM,Subsets II,43.9,0.595072748658621,https://leetcode.com/problems/subsets-ii,"Array, Backtracking, Bit Manipulation",3
MEDIUM,Unique Paths II,30.1,0.4315436499772203,https://leetcode.com/problems/unique-paths-ii,"Array, Dynamic Programming, Matrix",3
MEDIUM,3Sum Closest,44.6,0.468869600214817,https://leetcode.com/problems/3sum-closest,"Array, Two Pointers, Sorting",3
MEDIUM,Decode Ways,45.2,0.3653098525409497,https://leetcode.com/problems/decode-ways,"String, Dynamic Programming",3
MEDIUM,Divide Two Integers,45.8,0.1839697508503305,https://leetcode.com/problems/divide-two-integers,"Math, Bit Manipulation",3
MEDIUM,Combination Sum II,45.8,0.5767453180420465,https://leetcode.com/problems/combination-sum-ii,"Array, Backtracking",3
EASY,Search Insert Position,51.1,0.4901242260459721,https://leetcode.com/problems/search-insert-position,"Array, Binary Search",3
HARD,Wildcard Matching,42.6,0.2989835093068089,https://leetcode.com/problems/wildcard-matching,"String, Dynamic Programming, Greedy, Recursion",3
MEDIUM,Combination Sum,51.5,0.746747008868086,https://leetcode.com/problems/combination-sum,"Array, Backtracking",3
MEDIUM,Zigzag Conversion,51.9,0.5160676713980508,https://leetcode.com/problems/zigzag-conversion,String,3
HARD,Minimum Window Substring,51.9,0.4535073359144813,https://leetcode.com/problems/minimum-window-substring,"Hash Table, String, Sliding Window",3
MEDIUM,"Pow(x, n)",56.2,0.3702318823521848,https://leetcode.com/problems/powx-n,"Math, Recursion",3
HARD,Regular Expression Matching,56.5,0.2928013101016923,https://leetcode.com/problems/regular-expression-matching,"String, Dynamic Programming, Recursion",3
HARD,Largest Rectangle in Histogram,61.8,0.4737765317407914,https://leetcode.com/problems/largest-rectangle-in-histogram,"Array, Stack, Monotonic Stack",3
EASY,Same Tree,43.9,0.651268811570624,https://leetcode.com/problems/same-tree,"Tree, Depth-First Search, Breadth-First Search, Binary Tree",3
MEDIUM,Find Minimum in Rotated Sorted Array,34.3,0.526482393510494,https://leetcode.com/problems/find-minimum-in-rotated-sorted-array,"Array, Binary Search",3
MEDIUM,Count and Say,38.8,0.6050656775612677,https://leetcode.com/problems/count-and-say,String,3
MEDIUM,Search in Rotated Sorted Array II,41.9,0.3887965146188378,https://leetcode.com/problems/search-in-rotated-sorted-array-ii,"Array, Binary Search",3
MEDIUM,Unique Binary Search Trees II,37.0,0.6039807221122715,https://leetcode.com/problems/unique-binary-search-trees-ii,"Dynamic Programming, Backtracking, Tree, Binary Search Tree, Binary Tree",3
EASY,Binary Tree Inorder Traversal,38.8,0.7858399006715053,https://leetcode.com/problems/binary-tree-inorder-traversal,"Stack, Tree, Depth-First Search, Binary Tree",3
HARD,Sudoku Solver,40.4,0.6390871778033164,https://leetcode.com/problems/sudoku-solver,"Array, Hash Table, Backtracking, Matrix",3
MEDIUM,Edit Distance,38.8,0.5878974125922288,https://leetcode.com/problems/edit-distance,"String, Dynamic Programming",3
MEDIUM,Count Primes,70.6,0.347906460282023,https://leetcode.com/problems/count-primes,"Array, Math, Enumeration, Number Theory",2
EASY,Maximum Product of Two Elements in an Array,34.3,0.8322491861778356,https://leetcode.com/problems/maximum-product-of-two-elements-in-an-array,"Array, Sorting, Heap (Priority Queue)",2
MEDIUM,Sort Characters By Frequency,40.7,0.740805706977204,https://leetcode.com/problems/sort-characters-by-frequency,"Hash Table, String, Sorting, Heap (Priority Queue), Bucket Sort, Counting",2
MEDIUM,Meeting Rooms II,40.7,0.5214162081616772,https://leetcode.com/problems/meeting-rooms-ii,"Array, Two Pointers, Greedy, Sorting, Heap (Priority Queue), Prefix Sum",2
MEDIUM,Top K Frequent Elements,34.3,0.6456597904229384,https://leetcode.com/problems/top-k-frequent-elements,"Array, Hash Table, Divide and Conquer, Sorting, Heap (Priority Queue), Bucket Sort, Counting, Quickselect",2
MEDIUM,Remove K Digits,34.3,0.3494044611317414,https://leetcode.com/problems/remove-k-digits,"String, Stack, Greedy, Monotonic Stack",2
EASY,Two Sum IV - Input is a BST,34.3,0.6221872185096279,https://leetcode.com/problems/two-sum-iv-input-is-a-bst,"Hash Table, Two Pointers, Tree, Depth-First Search, Breadth-First Search, Binary Search Tree, Binary Tree",2
MEDIUM,Beautiful Arrangement,34.3,0.6452784543104094,https://leetcode.com/problems/beautiful-arrangement,"Array, Dynamic Programming, Backtracking, Bit Manipulation, Bitmask",2
HARD,Partition Array Into Two Arrays to Minimize Sum Difference,69.8,0.2175277160154665,https://leetcode.com/problems/partition-array-into-two-arrays-to-minimize-sum-difference,"Array, Two Pointers, Binary Search, Dynamic Programming, Bit Manipulation, Ordered Set, Bitmask",2
EASY,Find Winner on a Tic Tac Toe Game,73.0,0.5418363660832548,https://leetcode.com/problems/find-winner-on-a-tic-tac-toe-game,"Array, Hash Table, Matrix, Simulation",2
MEDIUM,Subarray Sum Equals K,34.3,0.4547621062131595,https://leetcode.com/problems/subarray-sum-equals-k,"Array, Hash Table, Prefix Sum",2
MEDIUM,Min Stack,34.3,0.5644513974486727,https://leetcode.com/problems/min-stack,"Stack, Design",2
HARD,Serialize and Deserialize Binary Tree,49.9,0.5896946953630543,https://leetcode.com/problems/serialize-and-deserialize-binary-tree,"String, Tree, Depth-First Search, Breadth-First Search, Design, Binary Tree",2
MEDIUM,Find Peak Element,53.8,0.4650922426070062,https://leetcode.com/problems/find-peak-element,"Array, Binary Search",2
MEDIUM,Copy List with Random Pointer,87.5,0.6053674363634336,https://leetcode.com/problems/copy-list-with-random-pointer,"Hash Table, Linked List",2
EASY,Power of Two,47.1,0.4838037051534944,https://leetcode.com/problems/power-of-two,"Math, Bit Manipulation, Recursion",2
EASY,Valid Anagram,70.3,0.6666098386966278,https://leetcode.com/problems/valid-anagram,"Hash Table, String, Sorting",2
MEDIUM,Maximum Product Subarray,46.6,0.3494162954383182,https://leetcode.com/problems/maximum-product-subarray,"Array, Dynamic Programming",2
MEDIUM,Implement Trie (Prefix Tree),49.9,0.6793476261333812,https://leetcode.com/problems/implement-trie-prefix-tree,"Hash Table, String, Design, Trie",2
HARD,Word Ladder,41.3,0.4281180881873274,https://leetcode.com/problems/word-ladder,"Hash Table, String, Breadth-First Search",2
HARD,Binary Tree Maximum Path Sum,56.6,0.4122426484532653,https://leetcode.com/problems/binary-tree-maximum-path-sum,"Dynamic Programming, Tree, Depth-First Search, Binary Tree",2
MEDIUM,Binary Tree Zigzag Level Order Traversal,33.6,0.6168283891746636,https://leetcode.com/problems/binary-tree-zigzag-level-order-traversal,"Tree, Breadth-First Search, Binary Tree",2
HARD,Find Median from Data Stream,61.7,0.5327813617707072,https://leetcode.com/problems/find-median-from-data-stream,"Two Pointers, Design, Sorting, Heap (Priority Queue), Data Stream",2
MEDIUM,Basic Calculator II,28.6,0.4581129812287864,https://leetcode.com/problems/basic-calculator-ii,"Math, String, Stack",2
MEDIUM,Second Highest Salary,23.5,0.4386508095849322,https://leetcode.com/problems/second-highest-salary,Database,2
EASY,Valid Palindrome,34.3,0.5096353524593524,https://leetcode.com/problems/valid-palindrome,"Two Pointers, String",2
HARD,Best Time to Buy and Sell Stock IV,19.1,0.4708615439104682,https://leetcode.com/problems/best-time-to-buy-and-sell-stock-iv,"Array, Dynamic Programming",2
MEDIUM,Rectangle Area,13.3,0.4737387162244031,https://leetcode.com/problems/rectangle-area,"Math, Geometry",2
MEDIUM,Lowest Common Ancestor of a Binary Search Tree,28.6,0.6831069193376744,https://leetcode.com/problems/lowest-common-ancestor-of-a-binary-search-tree,"Tree, Depth-First Search, Binary Search Tree, Binary Tree",2
MEDIUM,Two Sum II - Input Array Is Sorted,34.6,0.6340212187293719,https://leetcode.com/problems/two-sum-ii-input-array-is-sorted,"Array, Two Pointers, Binary Search",2
HARD,Valid Number,16.2,0.2156351250311539,https://leetcode.com/problems/valid-number,String,2
HARD,Permutation Sequence,33.9,0.4994329004732563,https://leetcode.com/problems/permutation-sequence,"Math, Recursion",2
HARD,Scramble String,9.5,0.4218190083551487,https://leetcode.com/problems/scramble-string,"String, Dynamic Programming",2
MEDIUM,Populating Next Right Pointers in Each Node,16.7,0.6544147769490073,https://leetcode.com/problems/populating-next-right-pointers-in-each-node,"Linked List, Tree, Depth-First Search, Breadth-First Search, Binary Tree",2
EASY,Maximum Depth of Binary Tree,39.3,0.7713813958630182,https://leetcode.com/problems/maximum-depth-of-binary-tree,"Tree, Depth-First Search, Breadth-First Search, Binary Tree",2
HARD,Longest Valid Parentheses,45.8,0.3631311456770452,https://leetcode.com/problems/longest-valid-parentheses,"String, Dynamic Programming, Stack",2
EASY,Fizz Buzz,63.3,0.7437057263879774,https://leetcode.com/problems/fizz-buzz,"Math, String, Simulation",2
EASY,Pascal's Triangle,62.3,0.770215491719448,https://leetcode.com/problems/pascals-triangle,"Array, Dynamic Programming",2
HARD,N-Queens II,16.2,0.7672955295381376,https://leetcode.com/problems/n-queens-ii,Backtracking,2
MEDIUM,Permutations II,25.4,0.615917727605333,https://leetcode.com/problems/permutations-ii,"Array, Backtracking, Sorting",2
EASY,Middle of the Linked List,100.0,0.8058170744812857,https://leetcode.com/problems/middle-of-the-linked-list,"Linked List, Two Pointers",2
EASY,Single Number,42.0,0.7596884851488054,https://leetcode.com/problems/single-number,"Array, Bit Manipulation",2
EASY,Balanced Binary Tree,41.9,0.5534204897752865,https://leetcode.com/problems/balanced-binary-tree,"Tree, Depth-First Search, Binary Tree",2
MEDIUM,Gray Code,13.1,0.6187231456205623,https://leetcode.com/problems/gray-code,"Math, Backtracking, Bit Manipulation",2
EASY,Symmetric Tree,48.0,0.5927867908424697,https://leetcode.com/problems/symmetric-tree,"Tree, Depth-First Search, Breadth-First Search, Binary Tree",2
MEDIUM,Ways to Make a Fair Array,40.7,0.644989189340971,https://leetcode.com/problems/ways-to-make-a-fair-array,"Array, Prefix Sum",1
MEDIUM,Swapping Nodes in a Linked List,40.7,0.6846789757668836,https://leetcode.com/problems/swapping-nodes-in-a-linked-list,"Linked List, Two Pointers",1
EASY,Print in Order,40.7,0.7158816436054449,https://leetcode.com/problems/print-in-order,Concurrency,1
MEDIUM,Minimum Size Subarray Sum,40.7,0.4939103221302616,https://leetcode.com/problems/minimum-size-subarray-sum,"Array, Binary Search, Sliding Window, Prefix Sum",1
MEDIUM,Valid Triangle Number,40.7,0.5234449388412803,https://leetcode.com/problems/valid-triangle-number,"Array, Two Pointers, Binary Search, Greedy, Sorting",1
HARD,Longest Increasing Path in a Matrix,40.7,0.5534762586302827,https://leetcode.com/problems/longest-increasing-path-in-a-matrix,"Array, Dynamic Programming, Depth-First Search, Breadth-First Search, Graph, Topological Sort, Memoization, Matrix",1
EASY,Check if Binary String Has at Most One Segment of Ones,34.3,0.3902918338056159,https://leetcode.com/problems/check-if-binary-string-has-at-most-one-segment-of-ones,String,1
MEDIUM,Course Schedule,40.7,0.492342767405502,https://leetcode.com/problems/course-schedule,"Depth-First Search, Breadth-First Search, Graph, Topological Sort",1
MEDIUM,Verify Preorder Sequence in Binary Search Tree,40.7,0.5131875685225266,https://leetcode.com/problems/verify-preorder-sequence-in-binary-search-tree,"Array, Stack, Tree, Binary Search Tree, Recursion, Monotonic Stack, Binary Tree",1
MEDIUM,Range Sum Query 2D - Immutable,40.7,0.5652765632997782,https://leetcode.com/problems/range-sum-query-2d-immutable,"Array, Design, Matrix, Prefix Sum",1
MEDIUM,Double a Number Represented as a Linked List,40.7,0.6123579966413119,https://leetcode.com/problems/double-a-number-represented-as-a-linked-list,"Linked List, Math, Stack",1
MEDIUM,Delete Node in a Linked List,40.7,0.8231559199073729,https://leetcode.com/problems/delete-node-in-a-linked-list,Linked List,1
MEDIUM,Robot Bounded In Circle,40.7,0.5622965278408281,https://leetcode.com/problems/robot-bounded-in-circle,"Math, String, Simulation",1
MEDIUM,Subarray Product Less Than K,40.7,0.5285345535980827,https://leetcode.com/problems/subarray-product-less-than-k,"Array, Binary Search, Sliding Window, Prefix Sum",1
MEDIUM,String Compression III,73.0,0.6681506980036712,https://leetcode.com/problems/string-compression-iii,String,1
HARD,Maximum Number of Ones,73.0,0.6875,https://leetcode.com/problems/maximum-number-of-ones,"Math, Greedy, Sorting, Heap (Priority Queue)",1
EASY,Rectangle Overlap,40.7,0.4574464867540109,https://leetcode.com/problems/rectangle-overlap,"Math, Geometry",1
MEDIUM,Maximal Square,49.9,0.4876133314788993,https://leetcode.com/problems/maximal-square,"Array, Dynamic Programming, Matrix",1
MEDIUM,Number of Operations to Make Network Connected,40.7,0.6466492016136093,https://leetcode.com/problems/number-of-operations-to-make-network-connected,"Depth-First Search, Breadth-First Search, Union Find, Graph",1
EASY,Greatest Common Divisor of Strings,40.7,0.5272393278503121,https://leetcode.com/problems/greatest-common-divisor-of-strings,"Math, String",1
