Difficulty,Title,Frequency,Acceptance Rate,Link,Topics,count
HARD,Read N Characters Given read4 II - Call Multiple Times,9.8,0.4290596992252771,https://leetcode.com/problems/read-n-characters-given-read4-ii-call-multiple-times,"Array, Simulation, Interactive",1
MEDIUM,Count Zero Request Servers,100.0,0.3412006497165777,https://leetcode.com/problems/count-zero-request-servers,"Array, Hash Table, Sliding Window, Sorting",1
EASY,Minimum Distance to the Target Element,89.6,0.5422827262892175,https://leetcode.com/problems/minimum-distance-to-the-target-element,Array,1
MEDIUM,Maximum Matrix Sum,89.6,0.6590661100173162,https://leetcode.com/problems/maximum-matrix-sum,"Array, Greedy, Matrix",1
MEDIUM,Flatten Binary Tree to Linked List,16.7,0.6851010744073592,https://leetcode.com/problems/flatten-binary-tree-to-linked-list,"Linked List, Stack, Tree, Depth-First Search, Binary Tree",1
MEDIUM,Triangle,23.6,0.592942154897156,https://leetcode.com/problems/triangle,"Array, Dynamic Programming",1
MEDIUM,Find Consecutive Integers from a Data Stream,60.7,0.493503487439047,https://leetcode.com/problems/find-consecutive-integers-from-a-data-stream,"Hash Table, Design, Queue, Counting, Data Stream",1
EASY,Maximum Nesting Depth of the Parentheses,60.7,0.8434417458535225,https://leetcode.com/problems/maximum-nesting-depth-of-the-parentheses,"String, Stack",1
MEDIUM,Boundary of Binary Tree,100.0,0.4715862928790685,https://leetcode.com/problems/boundary-of-binary-tree,"Tree, Depth-First Search, Binary Tree",1
MEDIUM,Add Two Numbers II,100.0,0.6175467587896241,https://leetcode.com/problems/add-two-numbers-ii,"Linked List, Math, Stack",1
EASY,Create Hello World Function,60.8,0.8212981936329484,https://leetcode.com/problems/create-hello-world-function,,1
