Difficulty,Title,Frequency,Acceptance Rate,Link,Topics,count
EASY,Two Sum,100.0,0.5577698896587009,https://leetcode.com/problems/two-sum,"Array, Hash Table",8
EASY,Valid Parentheses,73.6,0.4232281667216221,https://leetcode.com/problems/valid-parentheses,"String, Stack",8
MEDIUM,Maximum Subarray,73.1,0.5209978310902755,https://leetcode.com/problems/maximum-subarray,"Array, Divide and Conquer, Dynamic Programming",7
MEDIUM,Number of Islands,71.9,0.623199409488447,https://leetcode.com/problems/number-of-islands,"Array, Depth-First Search, Breadth-First Search, Union Find, Matrix",6
MEDIUM,Rotate Image,58.9,0.7790164518819447,https://leetcode.com/problems/rotate-image,"Array, Math, Matrix",6
MEDIUM,Spiral Matrix,60.5,0.5393973501075863,https://leetcode.com/problems/spiral-matrix,"Array, Matrix, Simulation",6
MEDIUM,Merge Intervals,80.5,0.4939526774846352,https://leetcode.com/problems/merge-intervals,"Array, Sorting",6
MEDIUM,Longest Substring Without Repeating Characters,82.5,0.3693616682204484,https://leetcode.com/problems/longest-substring-without-repeating-characters,"Hash Table, String, Sliding Window",6
MEDIUM,Add Two Numbers,77.7,0.4622507658063209,https://leetcode.com/problems/add-two-numbers,"Linked List, Math, Recursion",5
MEDIUM,String to Integer (atoi),44.2,0.1922942349527772,https://leetcode.com/problems/string-to-integer-atoi,String,5
MEDIUM,LRU Cache,100.0,0.4521455851903244,https://leetcode.com/problems/lru-cache,"Hash Table, Linked List, Design, Doubly-Linked List",5
MEDIUM,Letter Combinations of a Phone Number,55.1,0.6385756647080152,https://leetcode.com/problems/letter-combinations-of-a-phone-number,"Hash Table, String, Backtracking",5
HARD,Trapping Rain Water,87.4,0.6510192881379091,https://leetcode.com/problems/trapping-rain-water,"Array, Two Pointers, Dynamic Programming, Stack, Monotonic Stack",5
HARD,Merge k Sorted Lists,77.3,0.567741907864408,https://leetcode.com/problems/merge-k-sorted-lists,"Linked List, Divide and Conquer, Heap (Priority Queue), Merge Sort",5
EASY,Merge Sorted Array,69.9,0.5291952052651709,https://leetcode.com/problems/merge-sorted-array,"Array, Two Pointers, Sorting",5
MEDIUM,Longest Palindromic Substring,70.4,0.3584611475412551,https://leetcode.com/problems/longest-palindromic-substring,"Two Pointers, String, Dynamic Programming",5
MEDIUM,Search in Rotated Sorted Array,73.1,0.4283722138743466,https://leetcode.com/problems/search-in-rotated-sorted-array,"Array, Binary Search",5
MEDIUM,Group Anagrams,79.9,0.7092881943320976,https://leetcode.com/problems/group-anagrams,"Array, Hash Table, String, Sorting",5
MEDIUM,Find First and Last Position of Element in Sorted Array,60.5,0.4682873183580639,https://leetcode.com/problems/find-first-and-last-position-of-element-in-sorted-array,"Array, Binary Search",4
EASY,Reverse Linked List,58.9,0.7920654119580827,https://leetcode.com/problems/reverse-linked-list,"Linked List, Recursion",4
MEDIUM,Remove Nth Node From End of List,42.3,0.4896103052563428,https://leetcode.com/problems/remove-nth-node-from-end-of-list,"Linked List, Two Pointers",4
EASY,Find the Index of the First Occurrence in a String,47.5,0.4497159268881767,https://leetcode.com/problems/find-the-index-of-the-first-occurrence-in-a-string,"Two Pointers, String, String Matching",4
EASY,Roman to Integer,49.0,0.6486626948713667,https://leetcode.com/problems/roman-to-integer,"Hash Table, Math, String",4
MEDIUM,House Robber,38.9,0.5230495865734553,https://leetcode.com/problems/house-robber,"Array, Dynamic Programming",4
MEDIUM,Valid Sudoku,58.0,0.6227677721538815,https://leetcode.com/problems/valid-sudoku,"Array, Hash Table, Matrix",4
HARD,First Missing Positive,58.0,0.4108465766394882,https://leetcode.com/problems/first-missing-positive,"Array, Hash Table",4
MEDIUM,Reverse Integer,58.9,0.3030891688448359,https://leetcode.com/problems/reverse-integer,Math,4
HARD,Regular Expression Matching,45.9,0.2928013101016923,https://leetcode.com/problems/regular-expression-matching,"String, Dynamic Programming, Recursion",4
EASY,Linked List Cycle,28.9,0.5257062260569889,https://leetcode.com/problems/linked-list-cycle,"Hash Table, Linked List, Two Pointers",4
EASY,Best Time to Buy and Sell Stock,83.5,0.5525965868759138,https://leetcode.com/problems/best-time-to-buy-and-sell-stock,"Array, Dynamic Programming",4
MEDIUM,Container With Most Water,63.5,0.5778282574410597,https://leetcode.com/problems/container-with-most-water,"Array, Two Pointers, Greedy",4
EASY,Merge Two Sorted Lists,60.5,0.6684091757223755,https://leetcode.com/problems/merge-two-sorted-lists,"Linked List, Recursion",4
EASY,Remove Duplicates from Sorted Array,61.3,0.6035551112882038,https://leetcode.com/problems/remove-duplicates-from-sorted-array,"Array, Two Pointers",4
MEDIUM,3Sum,74.0,0.3707095392707933,https://leetcode.com/problems/3sum,"Array, Two Pointers, Sorting",4
MEDIUM,Generate Parentheses,68.4,0.7713286717803378,https://leetcode.com/problems/generate-parentheses,"String, Dynamic Programming, Backtracking",4
MEDIUM,Longest Consecutive Sequence,66.1,0.4704082801866521,https://leetcode.com/problems/longest-consecutive-sequence,"Array, Hash Table, Union Find",4
EASY,Longest Common Prefix,64.8,0.4548305505260665,https://leetcode.com/problems/longest-common-prefix,"String, Trie",4
MEDIUM,Combination Sum,49.0,0.746747008868086,https://leetcode.com/problems/combination-sum,"Array, Backtracking",3
MEDIUM,Subarray Sum Equals K,66.3,0.4547620378638278,https://leetcode.com/problems/subarray-sum-equals-k,"Array, Hash Table, Prefix Sum",3
MEDIUM,Rotate List,37.9,0.3994477271612808,https://leetcode.com/problems/rotate-list,"Linked List, Two Pointers",3
MEDIUM,Meeting Rooms II,47.7,0.5214167237275021,https://leetcode.com/problems/meeting-rooms-ii,"Array, Two Pointers, Greedy, Sorting, Heap (Priority Queue), Prefix Sum",3
MEDIUM,Gas Station,42.3,0.4638361778165814,https://leetcode.com/problems/gas-station,"Array, Greedy",3
HARD,Word Ladder,71.8,0.4281180881873274,https://leetcode.com/problems/word-ladder,"Hash Table, String, Breadth-First Search",3
MEDIUM,Permutations,50.3,0.8066011364163758,https://leetcode.com/problems/permutations,"Array, Backtracking",3
EASY,Palindrome Number,58.9,0.5922455404045137,https://leetcode.com/problems/palindrome-number,Math,3
MEDIUM,Product of Array Except Self,47.7,0.6777994606301018,https://leetcode.com/problems/product-of-array-except-self,"Array, Prefix Sum",3
MEDIUM,Zigzag Conversion,47.5,0.5160676713980508,https://leetcode.com/problems/zigzag-conversion,String,3
HARD,Sudoku Solver,40.2,0.6390871778033164,https://leetcode.com/problems/sudoku-solver,"Array, Hash Table, Backtracking, Matrix",3
MEDIUM,Course Schedule II,58.9,0.5342350291611208,https://leetcode.com/problems/course-schedule-ii,"Depth-First Search, Breadth-First Search, Graph, Topological Sort",3
EASY,Remove Element,42.3,0.600316358048653,https://leetcode.com/problems/remove-element,"Array, Two Pointers",3
MEDIUM,4Sum,52.8,0.3821902011379304,https://leetcode.com/problems/4sum,"Array, Two Pointers, Sorting",3
HARD,Reverse Nodes in k-Group,50.3,0.6304374335039493,https://leetcode.com/problems/reverse-nodes-in-k-group,"Linked List, Recursion",3
MEDIUM,Integer to Roman,51.6,0.6861931275088928,https://leetcode.com/problems/integer-to-roman,"Hash Table, Math, String",3
MEDIUM,Design Circular Queue,66.3,0.5264418953615425,https://leetcode.com/problems/design-circular-queue,"Array, Linked List, Design, Queue",3
MEDIUM,Minimum Path Sum,42.3,0.664814934885504,https://leetcode.com/problems/minimum-path-sum,"Array, Dynamic Programming, Matrix",3
MEDIUM,Divide Two Integers,35.3,0.1839697508503305,https://leetcode.com/problems/divide-two-integers,"Math, Bit Manipulation",3
MEDIUM,"Pow(x, n)",54.0,0.3702318823521848,https://leetcode.com/problems/powx-n,"Math, Recursion",3
EASY,Missing Number,38.9,0.7006534938999994,https://leetcode.com/problems/missing-number,"Array, Hash Table, Math, Binary Search, Bit Manipulation, Sorting",3
HARD,Binary Tree Maximum Path Sum,56.1,0.4122427095336609,https://leetcode.com/problems/binary-tree-maximum-path-sum,"Dynamic Programming, Tree, Depth-First Search, Binary Tree",3
MEDIUM,Copy List with Random Pointer,71.8,0.6053669280147949,https://leetcode.com/problems/copy-list-with-random-pointer,"Hash Table, Linked List",3
MEDIUM,Next Permutation,57.0,0.4305773671839413,https://leetcode.com/problems/next-permutation,"Array, Two Pointers",3
MEDIUM,Best Time to Buy and Sell Stock II,58.0,0.6950023404506479,https://leetcode.com/problems/best-time-to-buy-and-sell-stock-ii,"Array, Dynamic Programming, Greedy",3
EASY,Search Insert Position,24.7,0.4901242260459721,https://leetcode.com/problems/search-insert-position,"Array, Binary Search",3
MEDIUM,Jump Game II,60.5,0.4150321496760298,https://leetcode.com/problems/jump-game-ii,"Array, Dynamic Programming, Greedy",3
EASY,Valid Anagram,52.7,0.6666089667345674,https://leetcode.com/problems/valid-anagram,"Hash Table, String, Sorting",3
EASY,Move Zeroes,62.9,0.6280400947352507,https://leetcode.com/problems/move-zeroes,"Array, Two Pointers",2
MEDIUM,Evaluate Reverse Polish Notation,38.9,0.5495024017596329,https://leetcode.com/problems/evaluate-reverse-polish-notation,"Array, Math, Stack",2
EASY,First Unique Character in a String,69.3,0.6369545656040947,https://leetcode.com/problems/first-unique-character-in-a-string,"Hash Table, String, Queue, Counting",2
MEDIUM,Kth Largest Element in an Array,69.3,0.6797700833982673,https://leetcode.com/problems/kth-largest-element-in-an-array,"Array, Divide and Conquer, Sorting, Heap (Priority Queue), Quickselect",2
MEDIUM,Min Stack,74.2,0.5644508432974008,https://leetcode.com/problems/min-stack,"Stack, Design",2
MEDIUM,Word Break,78.3,0.4827377619034214,https://leetcode.com/problems/word-break,"Array, Hash Table, String, Dynamic Programming, Trie, Memoization",2
MEDIUM,3Sum Closest,19.6,0.468869600214817,https://leetcode.com/problems/3sum-closest,"Array, Two Pointers, Sorting",2
MEDIUM,Rotate Array,71.9,0.4302137279999349,https://leetcode.com/problems/rotate-array,"Array, Math, Two Pointers",2
EASY,Happy Number,47.7,0.5807264910173595,https://leetcode.com/problems/happy-number,"Hash Table, Math, Two Pointers",2
EASY,Majority Element,67.6,0.6574028018936169,https://leetcode.com/problems/majority-element,"Array, Hash Table, Divide and Conquer, Sorting, Counting",2
MEDIUM,Reverse Words in a String,58.9,0.5191327244735617,https://leetcode.com/problems/reverse-words-in-a-string,"Two Pointers, String",2
MEDIUM,Longest Increasing Subsequence,43.7,0.5780834572811812,https://leetcode.com/problems/longest-increasing-subsequence,"Array, Binary Search, Dynamic Programming",2
HARD,Median of Two Sorted Arrays,68.5,0.4381459000864632,https://leetcode.com/problems/median-of-two-sorted-arrays,"Array, Binary Search, Divide and Conquer",2
MEDIUM,Course Schedule,47.7,0.4923426491225658,https://leetcode.com/problems/course-schedule,"Depth-First Search, Breadth-First Search, Graph, Topological Sort",2
MEDIUM,Lowest Common Ancestor of a Binary Tree,47.7,0.6675499347216417,https://leetcode.com/problems/lowest-common-ancestor-of-a-binary-tree,"Tree, Depth-First Search, Binary Tree",2
HARD,Find Median from Data Stream,47.7,0.5327816407313548,https://leetcode.com/problems/find-median-from-data-stream,"Two Pointers, Design, Sorting, Heap (Priority Queue), Data Stream",2
HARD,Best Time to Buy and Sell Stock III,47.7,0.5112087693447603,https://leetcode.com/problems/best-time-to-buy-and-sell-stock-iii,"Array, Dynamic Programming",2
MEDIUM,Decode String,47.7,0.6115249906697672,https://leetcode.com/problems/decode-string,"String, Stack, Recursion",2
MEDIUM,Subarray Product Less Than K,38.9,0.5285340562664164,https://leetcode.com/problems/subarray-product-less-than-k,"Array, Binary Search, Sliding Window, Prefix Sum",2
HARD,Wildcard Matching,24.7,0.2989835093068089,https://leetcode.com/problems/wildcard-matching,"String, Dynamic Programming, Greedy, Recursion",2
EASY,Reverse String,38.9,0.7976436563508422,https://leetcode.com/problems/reverse-string,"Two Pointers, String",2
MEDIUM,Basic Calculator II,38.9,0.4581129812287864,https://leetcode.com/problems/basic-calculator-ii,"Math, String, Stack",2
MEDIUM,Two Sum II - Input Array Is Sorted,38.9,0.6340213036141924,https://leetcode.com/problems/two-sum-ii-input-array-is-sorted,"Array, Two Pointers, Binary Search",2
EASY,Isomorphic Strings,35.6,0.4685795790862557,https://leetcode.com/problems/isomorphic-strings,"Hash Table, String",2
EASY,Implement Queue using Stacks,38.9,0.6806072941218969,https://leetcode.com/problems/implement-queue-using-stacks,"Stack, Design, Queue",2
MEDIUM,Swap Nodes in Pairs,32.4,0.6720136828647639,https://leetcode.com/problems/swap-nodes-in-pairs,"Linked List, Recursion",2
HARD,Burst Balloons,37.2,0.6131500044712985,https://leetcode.com/problems/burst-balloons,"Array, Dynamic Programming",2
MEDIUM,Clone Graph,37.9,0.6238574692944873,https://leetcode.com/problems/clone-graph,"Hash Table, Depth-First Search, Breadth-First Search, Graph",2
HARD,Longest Valid Parentheses,49.0,0.3631311456770452,https://leetcode.com/problems/longest-valid-parentheses,"String, Dynamic Programming, Stack",2
EASY,Same Tree,28.9,0.651268811570624,https://leetcode.com/problems/same-tree,"Tree, Depth-First Search, Breadth-First Search, Binary Tree",2
HARD,N-Queens,49.0,0.7281704967757537,https://leetcode.com/problems/n-queens,"Array, Backtracking",2
EASY,Pascal's Triangle,49.0,0.770215491719448,https://leetcode.com/problems/pascals-triangle,"Array, Dynamic Programming",2
MEDIUM,Set Matrix Zeroes,50.3,0.6070877520170048,https://leetcode.com/problems/set-matrix-zeroes,"Array, Hash Table, Matrix",2
HARD,Largest Rectangle in Histogram,52.8,0.4737765317407914,https://leetcode.com/problems/largest-rectangle-in-histogram,"Array, Stack, Monotonic Stack",2
MEDIUM,Binary Tree Zigzag Level Order Traversal,54.0,0.6168283891746636,https://leetcode.com/problems/binary-tree-zigzag-level-order-traversal,"Tree, Breadth-First Search, Binary Tree",2
MEDIUM,Sort Colors,55.1,0.6758312948649591,https://leetcode.com/problems/sort-colors,"Array, Two Pointers, Sorting",2
HARD,Minimum Window Substring,56.1,0.4535073359144813,https://leetcode.com/problems/minimum-window-substring,"Hash Table, String, Sliding Window",2
HARD,Candy,56.1,0.4669973031537662,https://leetcode.com/problems/candy,"Array, Greedy",2
MEDIUM,Validate Binary Search Tree,45.9,0.3438038788666115,https://leetcode.com/problems/validate-binary-search-tree,"Tree, Depth-First Search, Binary Search Tree, Binary Tree",2
MEDIUM,Search a 2D Matrix,44.2,0.5228955161093151,https://leetcode.com/problems/search-a-2d-matrix,"Array, Binary Search, Matrix",2
EASY,Valid Palindrome,40.2,0.5096357249551178,https://leetcode.com/problems/valid-palindrome,"Two Pointers, String",2
MEDIUM,Unique Paths,59.7,0.6577283527258664,https://leetcode.com/problems/unique-paths,"Math, Dynamic Programming, Combinatorics",2
EASY,Single Number,49.0,0.7596882403268375,https://leetcode.com/problems/single-number,"Array, Bit Manipulation",2
HARD,Text Justification,32.4,0.4814988999917213,https://leetcode.com/problems/text-justification,"Array, String, Simulation",2
MEDIUM,Word Search,69.9,0.4526691452685235,https://leetcode.com/problems/word-search,"Array, String, Backtracking, Depth-First Search, Matrix",2
MEDIUM,Jump Game,69.4,0.3947920375919359,https://leetcode.com/problems/jump-game,"Array, Dynamic Programming, Greedy",2
EASY,Climbing Stairs,68.9,0.5354071346208594,https://leetcode.com/problems/climbing-stairs,"Math, Dynamic Programming, Memoization",2
MEDIUM,Subsets II,32.4,0.595072748658621,https://leetcode.com/problems/subsets-ii,"Array, Backtracking, Bit Manipulation",2
HARD,The Skyline Problem,100.0,0.4396240927117757,https://leetcode.com/problems/the-skyline-problem,"Array, Divide and Conquer, Binary Indexed Tree, Segment Tree, Line Sweep, Heap (Priority Queue), Ordered Set",1
EASY,Make The String Great,16.0,0.6827752983137568,https://leetcode.com/problems/make-the-string-great,"String, Stack",1
HARD,Meeting Rooms III,35.6,0.4393472442856221,https://leetcode.com/problems/meeting-rooms-iii,"Array, Hash Table, Sorting, Heap (Priority Queue), Simulation",1
HARD,Odd Even Jump,35.6,0.4072072749763881,https://leetcode.com/problems/odd-even-jump,"Array, Dynamic Programming, Stack, Monotonic Stack, Ordered Set",1
MEDIUM,Graph Valid Tree,16.0,0.4933560205084969,https://leetcode.com/problems/graph-valid-tree,"Depth-First Search, Breadth-First Search, Union Find, Graph",1
MEDIUM,Detect Squares,20.4,0.5130252857014308,https://leetcode.com/problems/detect-squares,"Array, Hash Table, Design, Counting",1
MEDIUM,Second Highest Salary,35.6,0.4386508095849322,https://leetcode.com/problems/second-highest-salary,Database,1
MEDIUM,Hand of Straights,20.4,0.5710230469118233,https://leetcode.com/problems/hand-of-straights,"Array, Hash Table, Greedy, Sorting",1
MEDIUM,Minimum Remove to Make Valid Parentheses,24.0,0.7074654274676669,https://leetcode.com/problems/minimum-remove-to-make-valid-parentheses,"String, Stack",1
EASY,Implement Stack using Queues,31.8,0.6733897915056893,https://leetcode.com/problems/implement-stack-using-queues,"Stack, Design, Queue",1
MEDIUM,Find All Possible Recipes from Given Supplies,31.8,0.5646091593277981,https://leetcode.com/problems/find-all-possible-recipes-from-given-supplies,"Array, Hash Table, String, Graph, Topological Sort",1
MEDIUM,Pacific Atlantic Water Flow,33.8,0.5753385838153038,https://leetcode.com/problems/pacific-atlantic-water-flow,"Array, Depth-First Search, Breadth-First Search, Matrix",1
HARD,Trapping Rain Water II,33.8,0.588762524838287,https://leetcode.com/problems/trapping-rain-water-ii,"Array, Breadth-First Search, Heap (Priority Queue), Matrix",1
HARD,Time Taken to Cross the Door,33.8,0.4947985404859871,https://leetcode.com/problems/time-taken-to-cross-the-door,"Array, Queue, Simulation",1
EASY,Moving Average from Data Stream,24.0,0.7993882465731537,https://leetcode.com/problems/moving-average-from-data-stream,"Array, Design, Queue, Data Stream",1
MEDIUM,Minimum Add to Make Parentheses Valid,100.0,0.746908249713867,https://leetcode.com/problems/minimum-add-to-make-parentheses-valid,"String, Stack, Greedy",1
MEDIUM,Delete Node in a Linked List,24.0,0.8231559199073729,https://leetcode.com/problems/delete-node-in-a-linked-list,Linked List,1
MEDIUM,Detonate the Maximum Bombs,27.0,0.492066898115528,https://leetcode.com/problems/detonate-the-maximum-bombs,"Array, Math, Depth-First Search, Breadth-First Search, Graph, Geometry",1
EASY,Get the Size of a DataFrame,16.0,0.8518924318016196,https://leetcode.com/problems/get-the-size-of-a-dataframe,,1
MEDIUM,Fruit Into Baskets,27.0,0.4642784173371472,https://leetcode.com/problems/fruit-into-baskets,"Array, Hash Table, Sliding Window",1
MEDIUM,Evaluate Division,31.8,0.6314695091079937,https://leetcode.com/problems/evaluate-division,"Array, String, Depth-First Search, Breadth-First Search, Union Find, Graph, Shortest Path",1
MEDIUM,Surrounded Regions,29.5,0.4288644756244931,https://leetcode.com/problems/surrounded-regions,"Array, Depth-First Search, Breadth-First Search, Union Find, Matrix",1
MEDIUM,Single Number II,31.8,0.6522776346186073,https://leetcode.com/problems/single-number-ii,"Array, Bit Manipulation",1
MEDIUM,Minimum Falling Path Sum,31.8,0.6144004812942054,https://leetcode.com/problems/minimum-falling-path-sum,"Array, Dynamic Programming, Matrix",1
MEDIUM,Random Pick with Weight,100.0,0.4827853398737957,https://leetcode.com/problems/random-pick-with-weight,"Array, Math, Binary Search, Prefix Sum, Randomized",1
MEDIUM,Maximize Greatness of an Array,100.0,0.5864617466875623,https://leetcode.com/problems/maximize-greatness-of-an-array,"Array, Two Pointers, Greedy, Sorting",1
HARD,Robot Room Cleaner,16.0,0.7752279751307165,https://leetcode.com/problems/robot-room-cleaner,"Backtracking, Interactive",1
EASY,Palindrome Linked List,44.1,0.558594601008929,https://leetcode.com/problems/palindrome-linked-list,"Linked List, Two Pointers, Stack, Recursion",1
EASY,Sqrt(x),50.0,0.4037178718652037,https://leetcode.com/problems/sqrtx,"Math, Binary Search",1
MEDIUM,Dot Product of Two Sparse Vectors,66.0,0.8993424664218707,https://leetcode.com/problems/dot-product-of-two-sparse-vectors,"Array, Hash Table, Two Pointers, Design",1
EASY,Reverse Bits,66.0,0.6320549868777902,https://leetcode.com/problems/reverse-bits,"Divide and Conquer, Bit Manipulation",1
MEDIUM,Asteroid Collision,66.0,0.455006598482349,https://leetcode.com/problems/asteroid-collision,"Array, Stack, Simulation",1
MEDIUM,Largest Number,66.0,0.412803811932624,https://leetcode.com/problems/largest-number,"Array, String, Greedy, Sorting",1
MEDIUM,Restore IP Addresses,47.2,0.531583393083398,https://leetcode.com/problems/restore-ip-addresses,"String, Backtracking",1
EASY,Last Stone Weight,66.0,0.6592869343167317,https://leetcode.com/problems/last-stone-weight,"Array, Heap (Priority Queue)",1
MEDIUM,Unique Paths II,77.0,0.4315436982936257,https://leetcode.com/problems/unique-paths-ii,"Array, Dynamic Programming, Matrix",1
EASY,To Be Or Not To Be,16.0,0.6295807994256238,https://leetcode.com/problems/to-be-or-not-to-be,,1
MEDIUM,Rotting Oranges,40.4,0.566185183855214,https://leetcode.com/problems/rotting-oranges,"Array, Breadth-First Search, Matrix",1
MEDIUM,Encode and Decode Strings,36.0,0.4969849870512122,https://leetcode.com/problems/encode-and-decode-strings,"Array, String, Design",1
MEDIUM,Max Consecutive Ones III,30.3,0.6593934025174093,https://leetcode.com/problems/max-consecutive-ones-iii,"Array, Binary Search, Sliding Window, Prefix Sum",1
EASY,Article Views I,22.6,0.7714463570524588,https://leetcode.com/problems/article-views-i,Database,1
EASY,Binary Tree Inorder Traversal,22.6,0.7858399541084903,https://leetcode.com/problems/binary-tree-inorder-traversal,"Stack, Tree, Depth-First Search, Binary Tree",1
MEDIUM,Target Sum,37.2,0.5076651123616494,https://leetcode.com/problems/target-sum,"Array, Dynamic Programming, Backtracking",1
MEDIUM,Multiply Strings,22.6,0.4228941429852704,https://leetcode.com/problems/multiply-strings,"Math, String, Simulation",1
HARD,Basic Calculator,62.8,0.4558962794405194,https://leetcode.com/problems/basic-calculator,"Math, String, Stack, Recursion",1
MEDIUM,Daily Temperatures,66.0,0.673649951600241,https://leetcode.com/problems/daily-temperatures,"Array, Stack, Monotonic Stack",1
MEDIUM,Find Peak Element,64.1,0.4650923697604918,https://leetcode.com/problems/find-peak-element,"Array, Binary Search",1
MEDIUM,Count the Number of Fair Pairs,87.2,0.5291637303813359,https://leetcode.com/problems/count-the-number-of-fair-pairs,"Array, Two Pointers, Binary Search, Sorting",1
MEDIUM,Find the Safest Path in a Grid,16.0,0.4839726918075422,https://leetcode.com/problems/find-the-safest-path-in-a-grid,"Array, Binary Search, Breadth-First Search, Union Find, Heap (Priority Queue), Matrix",1
HARD,Word Search II,10.5,0.3732633211647155,https://leetcode.com/problems/word-search-ii,"Array, String, Backtracking, Trie, Matrix",1
MEDIUM,Is Graph Bipartite?,60.9,0.577138580849355,https://leetcode.com/problems/is-graph-bipartite,"Depth-First Search, Breadth-First Search, Union Find, Graph",1
MEDIUM,Possible Bipartition,80.9,0.5150773648728767,https://leetcode.com/problems/possible-bipartition,"Depth-First Search, Breadth-First Search, Union Find, Graph",1
MEDIUM,Smallest String Starting From Leaf,10.5,0.608103369683369,https://leetcode.com/problems/smallest-string-starting-from-leaf,"String, Backtracking, Tree, Depth-First Search, Binary Tree",1
HARD,Shortest Distance from All Buildings,10.5,0.4437276667084348,https://leetcode.com/problems/shortest-distance-from-all-buildings,"Array, Breadth-First Search, Matrix",1
HARD,Binary Tree Cameras,100.0,0.4718257360539049,https://leetcode.com/problems/binary-tree-cameras,"Dynamic Programming, Tree, Depth-First Search, Binary Tree",1
MEDIUM,Sell Diminishing-Valued Colored Balls,100.0,0.2996067002222998,https://leetcode.com/problems/sell-diminishing-valued-colored-balls,"Array, Math, Binary Search, Greedy, Sorting, Heap (Priority Queue)",1
MEDIUM,Shopping Offers,100.0,0.5190263317700597,https://leetcode.com/problems/shopping-offers,"Array, Dynamic Programming, Backtracking, Bit Manipulation, Memoization, Bitmask",1
EASY,Pass the Pillow,65.2,0.5655326422584914,https://leetcode.com/problems/pass-the-pillow,"Math, Simulation",1
EASY,Guess Number Higher or Lower,96.0,0.5577411651250909,https://leetcode.com/problems/guess-number-higher-or-lower,"Binary Search, Interactive",1
HARD,Count Subarrays With Fixed Bounds,65.2,0.6940834976032579,https://leetcode.com/problems/count-subarrays-with-fixed-bounds,"Array, Queue, Sliding Window, Monotonic Queue",1
HARD,Minimum Edge Reversals So Every Node Is Reachable,65.2,0.5529070058590816,https://leetcode.com/problems/minimum-edge-reversals-so-every-node-is-reachable,"Dynamic Programming, Depth-First Search, Breadth-First Search, Graph",1
MEDIUM,Number of Divisible Triplet Sums,65.2,0.6780637725701113,https://leetcode.com/problems/number-of-divisible-triplet-sums,"Array, Hash Table",1
HARD,Substring with Concatenation of All Words,96.0,0.329975374593568,https://leetcode.com/problems/substring-with-concatenation-of-all-words,"Hash Table, String, Sliding Window",1
MEDIUM,Maximize Distance to Closest Person,60.9,0.489870429548439,https://leetcode.com/problems/maximize-distance-to-closest-person,Array,1
MEDIUM,Flatten Nested List Iterator,54.0,0.6522839525510098,https://leetcode.com/problems/flatten-nested-list-iterator,"Stack, Tree, Depth-First Search, Design, Queue, Iterator",1
EASY,Big Countries,37.2,0.6818920862237663,https://leetcode.com/problems/big-countries,Database,1
MEDIUM,Calculate Score After Performing Instructions,74.2,0.5556368843981223,https://leetcode.com/problems/calculate-score-after-performing-instructions,"Array, Hash Table, String, Simulation",1
EASY,Path Sum,24.7,0.5300478045423143,https://leetcode.com/problems/path-sum,"Tree, Depth-First Search, Breadth-First Search, Binary Tree",1
